,from_id,from_name,message,created_time,type,link,id,story,likes_count,comments_count,shares_count
194,1.39E+14,IIT Gandhinagar,"Campus Feature: The Foundation Programme, IIT Gandhinagar is a unique program, one of its kind that brings out the creative, the cognitive, and values pertaining to individual and community ethics in the new batch of students. Follow the updates and fun on the Foundation Programme 2016 with their Live Tweets on Twitterid: @fpiitgn with the hashtags #iitgnfp #iitgn and Like them on Facebook @Foundation Programme, IIT Gandhinagar",2016-07-25T07:50:35+0000,photo,https://www.facebook.com/fpiitgn/photos/a.561558323886560.1073741830.550913558284370/1150223821686671/?type=3,139092996158047_1108458729221464,"IIT Gandhinagar shared Foundation Programme, IIT Gandhinagar's post.",54,0,0
195,1.39E+14,IIT Gandhinagar,"Mr. Faisal Farooqui, Founder of Mouthshut.com http://buff.ly/2a4YJoQ interacted with faculty and students at IIT Gandhinagar on 22nd July 2016. He talked about his journey of starting out as an entrepreneur, the challenges he faced, and shared his experiences with the start-up ecosystem.",2016-07-24T08:30:53+0000,photo,https://www.facebook.com/iitgn.official/photos/a.340943985972946.80216.139092996158047/1107820382618632/?type=3,139092996158047_1107820382618632,NA,36,0,0
196,1.39E+14,IIT Gandhinagar,"The Foundation Programme Inauguration Ceremony concluded today at IIT Gandhinagar. This event was a celebration of the freshmen’s new journey. The inaugural address was delivered by the honorable Chief Guest for the event Shri Maheshwar S. Sahu, former Indian Administrative Service officer. As per IITGN FP-tradition, former students of IIT Gandhinagar, Kislay Pankaj and Nisarg Shah were the alumni guests of honour and speakers on the occasion.

Pictures Courtesy: Gaurav Shukla and Dev Barbhaya",2016-07-22T15:30:00+0000,photo,https://www.facebook.com/iitgn.official/photos/a.340943985972946.80216.139092996158047/1106611669406170/?type=3,139092996158047_1106613562739314,IIT Gandhinagar added 10 new photos — with Atul Bhargav and 12 others.,112,1,8
197,1.39E+14,IIT Gandhinagar,"IIT Gandhinagar today hosted Lt. Gen Subrata Saha, Honourable Deputy Chief of Army Staff for an army-academia interactive session on 'Make in India' concept. The aim of the session was to promote and nurture partnership between our forces and IITGN in areas of mutual interest. Lt. General Saha and officers from the armed forces encouraged students and faculty for nation-building.
Pictures Courtesy: Gaurav Shukla",2016-07-22T11:52:04+0000,photo,https://www.facebook.com/iitgn.official/photos/a.340943985972946.80216.139092996158047/1106590896074914/?type=3,139092996158047_1106591946074809,IIT Gandhinagar added 6 new photos — with Sudhir K Jain and 4 others.,177,0,8
198,1.39E+14,IIT Gandhinagar,"#ThrowbackThursday

 IITGandhinagar (IITGN) community planted around 100 saplings in the campus to mark the celebration of World Environment Day on 5th June 2016. The event was initiated by a group of students at the institute called ‘Green Gang’.  This #TBT is dedicated to the world environment day event. 

Picture Courtesy: Devarsh Barbhaya",2016-07-21T13:31:07+0000,photo,https://www.facebook.com/iitgn.official/photos/a.340943985972946.80216.139092996158047/1105997772800893/?type=3,139092996158047_1105997772800893,NA,159,1,3
199,1.39E+14,IIT Gandhinagar,"Foundation Programme, IIT Gandhinagar is all set to begin with a new team, new faces, and new ideas. Check out latest updates and news of the FP@IITGN on their social media page: https://www.facebook.com/fpiitgn/.
 Keep yourself updated with the latest talks, activities, and events happening in this unique 5 week Foundation Program@IITGN.",2016-07-20T07:07:00+0000,photo,https://www.facebook.com/fpiitgn/photos/a.1146227502086303.1073741837.550913558284370/1146227818752938/?type=3,139092996158047_1105193539547983,"IIT Gandhinagar shared Foundation Programme, IIT Gandhinagar's album.",48,0,0
200,1.39E+14,IIT Gandhinagar,"2016-Undergraduate students joining IIT Gandhinagar: do check the important links. You can take the institute bus from Visat Circle to IITGN Palaj, they are pretty frequent. Foundation Program team also has a contact email id as helpline in case you feel lost: fp@iitgn.ac.in. 

FP 2016 homepage: http://buff.ly/29LFfBB
FP 2016 bus shuttle schedule: http://buff.ly/29LFdJK
FP 2016 schedule: http://buff.ly/29LFyfK

Welcome to IIT Gandhinagar! :)",2016-07-19T13:31:09+0000,link,http://buff.ly/29LFfBB,139092996158047_1104700959597241,NA,73,1,6
201,1.39E+14,IIT Gandhinagar,"IIT Gandhinagar is organizing a two-day workshop titled “Reflections on Six Years of Right to Education Act- 2009” from 22nd to 23rd July 2016. 

This workshop will provide a common forum for academics, policy makers, and teachers for comprehensive review, debate, and discussion on the RTE Act and its implementation. The workshop will address a wide range of issues and policies on ensuring basic education as fundamental right followed by discussions on the draft of new ""National Education Policy-2016"".

IIT Gandhinagar Contact: Professor Shivakumar Jolad

For more details visit the workshop website http://buff.ly/29IGz8h",2016-07-18T13:31:16+0000,photo,https://www.facebook.com/iitgn.official/photos/a.340943985972946.80216.139092996158047/1103983659668971/?type=3,139092996158047_1103983659668971,NA,22,0,1
202,1.39E+14,IIT Gandhinagar,"If you like the winning cover-pictures of IIT Gandhinagar, you may want to explore our featured pictures, winning entries of IITGN Twitter cover, Student Life Facebook cover, and much more at the picture blog: http://iitgnphotocontest.xyz/tag/Featured-June-2016/",2016-07-16T13:30:00+0000,link,http://iitgnphotocontest.xyz/tag/Featured-June-2016/,139092996158047_1102098439857493,NA,26,1,0
203,1.39E+14,IIT Gandhinagar,"IIT Gandhinagar in association with Desai Foundation organized an open house for the ongoing Vocational Skills Training Program on July 15 2016 on the occassion of World Youth Skills Day.
Picture Courtesy: Gaurav Shukla",2016-07-15T16:30:00+0000,photo,https://www.facebook.com/iitgn.official/photos/a.340943985972946.80216.139092996158047/1102094949857842/?type=3,139092996158047_1102095313191139,IIT Gandhinagar added 2 new photos.,44,0,1
204,1.39E+14,IIT Gandhinagar,Winning Entry for Facebook Cover June 2016 by Satish Meena,2016-07-15T12:07:54+0000,photo,https://www.facebook.com/iitgn.official/photos/a.297192597014752.71354.139092996158047/1102064293194241/?type=3,139092996158047_1102064293194241,IIT Gandhinagar updated their cover photo.,156,0,1
205,1.39E+14,IIT Gandhinagar,NA,2016-07-15T04:36:34+0000,photo,https://www.facebook.com/Neeviitgn/photos/a.1651396508425307.1073741828.1629543820610576/1797960647102225/?type=3,139092996158047_1101894269877910,IIT Gandhinagar shared NEEV IITGN's photo.,15,0,0
206,1.39E+14,IIT Gandhinagar,"#ThrowbackThursday

As the Indian Institute of Technology Gandhinagar gears-up for its Foundation program-2016 for the fresh batch of Undergraduate student in the coming weeks, we give you a glimpse of the first foundation program held in 2011 for this #ThrowbackThursday  #TBT

Picture Courtesy: Gaurav Shukla",2016-07-14T16:30:46+0000,photo,https://www.facebook.com/iitgn.official/photos/a.340943985972946.80216.139092996158047/1101549033245767/?type=3,139092996158047_1101549033245767,NA,64,2,0
207,1.39E+14,IIT Gandhinagar,"A two-day short-course  on ""Geosynthetics Applications in Infrastructure Development"" was inaugurated today,14th July 2016 at IIT Gandhinagar. The course is being attended by engineers, students, faculty and senior professionals from all over the country.",2016-07-14T12:42:30+0000,photo,https://www.facebook.com/iitgn.official/photos/a.340943985972946.80216.139092996158047/1101419039925433/?type=3,139092996158047_1101421046591899,IIT Gandhinagar added 3 new photos — with Sudhir K Jain and Amit Prashant.,49,1,1
208,1.39E+14,IIT Gandhinagar,"IITGN Daycare in association with Organic Farm has started a new farming project for our community kids called Kids Supported Agriculture (KSA). This initiative aims to introduce our children to farming practices in order to help them understand where and how the food we eat grows.
The first KSA project program started on Wednesday, July 6th with a set of interesting agricultural activities.  During the course of the project, children dig, sow, water, pluck, assemble and get their produce ready for selling. The idea is to help children appreciate and value the efforts of farmers in India and also encourage them to understand the significance of being eco-sensitive.

Picture Courtesy: Daycare IITGN",2016-07-13T13:31:34+0000,photo,https://www.facebook.com/iitgn.official/photos/a.340943985972946.80216.139092996158047/1100739723326698/?type=3,139092996158047_1100739723326698,NA,126,1,14
209,1.39E+14,IIT Gandhinagar,"For the fresh batches of Undergraduate, Postgraduate, and PhD students of IIT Gandhinagar, you could access the academic calendar at our website: http://www.iitgn.ac.in/acadcal16-17.htm. Do plan your trip accordingly.",2016-07-11T13:30:00+0000,link,http://www.iitgn.ac.in/acadcal16-17.htm,139092996158047_1099341043466566,NA,29,0,0
210,1.39E+14,IIT Gandhinagar,"The Summer Research Internship Program (SRIP) at IIT Gandhinagar offers an opportunity for bright students from across the country to work with the institute’s faculty members in ongoing research projects during summers. The number of applications for SRIP has increased over the years. The program which began on May 2nd 2016 concluded with a Poster Presentation on July 6th 2016 by the summer interns. The posters are related to their research projects undertaken at IITGN. Overall 35 posters were presented by interns across the disciplines. Visitors came up with comments and questions on the posters.

Pictures by:  Dev Barbhaya",2016-07-07T14:00:00+0000,photo,https://www.facebook.com/iitgn.official/photos/a.340943985972946.80216.139092996158047/1096648930402444/?type=3,139092996158047_1096654047068599,IIT Gandhinagar added 12 new photos — with Gopal Kumar Choudhary and 2 others.,81,1,3
211,1.39E+14,IIT Gandhinagar,"It's a pleasure to have Prof. Samir D. Mathur, from the Ohio State University, visiting IIT Gandhinagar this summer. Prof Mathur has spent over two decades working on the black hole information paradox. He is now applying his insights about the paradox towards understanding singularity at the origin of the Universe, the Big Bang.

Starting today, he will be giving a series of lectures on the black hole Information paradox. This is a part of a GIAN course is organized by Prof Sudipta Sarkar. Find out more from the website at: http://buff.ly/1TXIpBu",2016-06-27T03:30:16+0000,photo,https://www.facebook.com/iitgn.official/photos/a.340943985972946.80216.139092996158047/1089850371082300/?type=3,139092996158047_1089850371082300,NA,34,0,1
212,1.39E+14,IIT Gandhinagar,"Prof Sudhir K Jain (Director, IITGN) and other senior administrators from IITGN were at Durham last week, visiting Duke University towards a series of workshops and discussions on June 16 and 17. This has been an exciting step forward in the IITGN-Duke partnership, facilitated by RTI International. 

http://today.duke.edu/2016/06/iitworkshop",2016-06-22T03:30:00+0000,link,http://today.duke.edu/2016/06/iitworkshop,139092996158047_1086203258113678,NA,100,0,0
213,1.39E+14,IIT Gandhinagar,"The JEE Open House at IITGN is back this weekend. Like the previous edition, we will have a campus tour and sessions with the Deans of Student and Academic Affairs, faculty members of various branches. The event is intended to help students and their parents make informed career choices.

This time, we will also have a special interactive session with Prof Dheeraj Sanghi in the afternoon.

We look forward to meeting you this Saturday! Register yourself at: http://goo.gl/forms/Mg05c7l4T7Jwt5sn2 

(Limited accommodation available on request.)",2016-06-16T12:09:37+0000,photo,https://www.facebook.com/iitgn.official/photos/a.340943985972946.80216.139092996158047/1082973885103282/?type=3,139092996158047_1082973885103282,IIT Gandhinagar with Nitya Garg.,20,2,1
214,1.39E+14,IIT Gandhinagar,"We're pleased to announce our MTech program in Biological Engineering - the deadline for applications is the 17th of June.

Find out more about Biological Engineering at IITGN from the website at http://bioe.iitgn.ac.in/",2016-06-15T11:00:00+0000,photo,https://www.facebook.com/iitgn.official/photos/a.340943985972946.80216.139092996158047/1082347045165966/?type=3,139092996158047_1082347045165966,NA,19,0,6
215,1.39E+14,IIT Gandhinagar,"We're pleased to announce our MTech program in Earth System Science - the deadline for applications is the 17th of June.

Find out more about the Earth Sciences discipline at IITGN from the website at http://www.iitgn.ac.in/academics/es/",2016-06-15T10:30:10+0000,photo,https://www.facebook.com/iitgn.official/photos/a.340943985972946.80216.139092996158047/1082348791832458/?type=3,139092996158047_1082348791832458,NA,12,0,1
216,1.39E+14,IIT Gandhinagar,Prof Amit Prashant inspires the graduating batch at Udaan 2016.,2016-06-15T08:30:25+0000,video,http://buff.ly/1Vy1hfy,139092996158047_1082307755169895,NA,40,0,0
217,1.39E+14,IIT Gandhinagar,"The IITGN fraternity congratulates Prof Chinmay Ghoroi, Prof Gaurav Srivastava, and Prof Arup Lal Chakraborty for receiving a funding of Rs 3.73 crores under the Uchhatar Avishkar Yojana (UAY). This is a research grant for a project involving the development of environment-friendly and cost-effective fire detection and suppression systems that can replace the existing ones. 

The goal is to develop products which are versatile in application and can be easily deployed. Prof Ghoroi, the principal investigator of the project, said, ""Since these systems which we will be developing are not water-based, they can practically be utilized in any kind of fire. Also, as small quantities of condensed aerosol powder can deal with relatively large fires, the products based on this technology will be much less bulky compared to their current alternatives.""
 
The program is the first of its kind in India which promotes product-oriented research to be jointly undertaken through private and public partnership. This project has a 1:3 cost sharing jointly with Vimal Fire Controls Private Limited (VFCPL), Mumbai.

Many congratulations to the team, and watch this space for updates on further developments!",2016-06-14T08:30:23+0000,photo,https://www.facebook.com/iitgn.official/photos/a.340943985972946.80216.139092996158047/1081698411897496/?type=3,139092996158047_1081698411897496,NA,262,7,3
218,1.39E+14,IIT Gandhinagar,"The High Energy Physics community in India has been organising SERC Schools in Theoretical High Energy Physics (THEP) since 1985. The objective of these schools is to train Ph.D. students in subjects one needs to learn to do research in THEP and, at the same time, to expose them to recent developments in the field. 

IITGN invites applications from PhD students for the upcoming SERC school to be held here during September 5 to October 1, 2016. The deadline to apply is 15th June 2016.

More details are at the website: http://www.iitgn.ac.in/serc/

Contact: Prof. Barath Coleppa or email sercthep16@iitgn.ac.in",2016-06-13T14:00:20+0000,photo,https://www.facebook.com/iitgn.official/photos/a.340943985972946.80216.139092996158047/1081234525277218/?type=3,139092996158047_1081234525277218,IIT Gandhinagar with Nitya Garg.,12,1,7
219,1.39E+14,IIT Gandhinagar,"We're excited to launch our dual major program, which enables students enrolled in the BTech programme to complete a second major in any other engineering discipline of their interest. 

More details can be found at the website: http://buff.ly/25X2AYv",2016-06-13T12:01:20+0000,photo,https://www.facebook.com/iitgn.official/photos/a.340943985972946.80216.139092996158047/1081190218614982/?type=3,139092996158047_1081190218614982,NA,85,8,25
220,1.39E+14,IIT Gandhinagar,"It's a pleasure to have Professor Hema Srinivasan, from University of Missouri, Columbia, USA, visiting us on June 14 and 15. 

She'll be giving a talk on the 15th of June titled ""On subadditivity of maximal shifts in the resolutions of graded algebras"". Further details are below, and all are welcome!

Venue: AB 07/ 102
Date: June 15, 2016
Time: 10:30 AM - 11:30 AM",2016-06-13T09:30:25+0000,status,NA,139092996158047_1081116855288985,NA,8,0,0
221,1.39E+14,IIT Gandhinagar,"IIT Gandhinagar is organizing the Newton-Bhabha India-UK advanced training school (IUATS) on Optimal design and control of Smart community: New ideas for off-grid communities during November 7-17, 2016. 

This training workshop is being coordinated by Dr Naran M. Pindoriya (Indian Institute of Technology Gandhinagar) and Dr. Francisco Gonzalez-Longatt (Loughborough University, U.K.). There is no course fee for participation and also all travel and accommodation expenses will be covered by the Newton-Bhabha IUATS programme.

The application form, with more details on this IUATS, can be found at http://buff.ly/20UsQiP

Deadline for applications: July 15, 2016",2016-06-13T08:30:15+0000,photo,https://www.facebook.com/iitgn.official/photos/a.340943985972946.80216.139092996158047/1081096798624324/?type=3,139092996158047_1081096798624324,NA,24,1,5
222,1.39E+14,IIT Gandhinagar,"On the 20th of June, at 4PM, Ms. Amila Jyothi Reddy will host an interactive session at the JB Auditorium, speaking about her inspiring journey from being a farm labourer to now leading a company whose turnover is in the millions of dollars. 

To partake in this special story, join the event organized by FICCI FLO, Gujarat (please see the attached image for the details).",2016-06-12T06:30:00+0000,photo,https://www.facebook.com/iitgn.official/photos/a.340943985972946.80216.139092996158047/1081250551942282/?type=3,139092996158047_1081250551942282,NA,15,0,3
223,1.39E+14,IIT Gandhinagar,Watch Prof Ramakrishnan addressing the graduating batch at Udaan 2016.,2016-06-08T08:30:16+0000,video,http://buff.ly/1sNHk91,139092996158047_1078100952257242,NA,24,0,0
224,1.39E+14,IIT Gandhinagar,"Today is the first day of the GIAN course on ""Asynchronous and Synchronous approaches to Network-on-chip (NoC) Architecture design"", organized by Prof Joycee Mekie. The course will feature lectures by Prof Peter Beerel, Prof. Virendra Singh and Prof Joycee Mekie. 

Prof Beerel is an Associate Professor in Electrical Engineering at the University of South California. He is also the Faculty Director of Innovation and Entrepreneurship in Engineering for the Viterbi School of Engineering. His research interests include a variety of topics in CAD and asynchronous VLSI design.

Prof Singh is a faculty member from IIT Bombay. He received his Ph.D in Computer Science in 2005 from Nara Institute of Science and Technology (NAIST) Kansai. His research interests span various themes including Computer Architecture Processor architecture and micro-architecture, VLSI Testing, and Fault-tolerant computing.

Find out more about this course from the website at:",2016-06-07T03:30:19+0000,link,http://buff.ly/1RrWipU,139092996158047_1077388965661774,NA,17,0,0
225,1.39E+14,IIT Gandhinagar,"This #WorldEnvironmentDay, here's an overview of the green initiatives employed at the IIT Gandhinagar campus.",2016-06-05T12:30:00+0000,photo,https://www.facebook.com/iitgn.official/photos/a.340943985972946.80216.139092996158047/1076382202429117/?type=3,139092996158047_1076382202429117,NA,192,4,36
226,1.39E+14,IIT Gandhinagar,"The IIT Gandhinagar fraternity congratulates Professor Chetan Pahlajani for receiving a grant from the Science and Engineering Research Board (SERB), towards the project ""Asymptotic problems for stochastically perturbed switching dynamical systems"".",2016-06-03T08:30:23+0000,status,NA,139092996158047_1075139609220043,NA,55,0,1
227,1.39E+14,IIT Gandhinagar,"This #ThrowbackThursday, we revisit a video on the state of quality education at schools in India, made by students of IITGN as a part of their course on Digital Cultures and New Media. 

In this video, Prof Shivakumar Jolad weighs in on the challenges pertaining to primary education.",2016-06-02T13:30:43+0000,video,http://buff.ly/1XR263p,139092996158047_1074630629270941,NA,35,0,2
228,1.39E+14,IIT Gandhinagar,"The IIT Gandhinagar fraternity congratulates Professor Indranath Sengupta for receiving a grant from  the Science and Engineering Research Board (SERB), towards the project on ""Gröbner Basis, Syzygies and Betti Numbers of Determinantal Ideals"".",2016-06-02T08:30:35+0000,status,NA,139092996158047_1074499212617416,NA,74,2,2
229,1.39E+14,IIT Gandhinagar,"The IIT Gandhinagar fraternity congratulates Professor Sharmistha Majumdar for receiving a grant from the Science and Engineering Research Board (SERB), towards the project on ""Mechanistic analysis of eukaryotic mobile genetic elements"".",2016-05-30T08:30:29+0000,status,NA,139092996158047_1072648022802535,NA,51,0,0
230,1.39E+14,IIT Gandhinagar,"All endings bring in beginnings, too. #SundayInspiration

Picture Courtesy: Devarsh Barbhaya",2016-05-29T15:38:56+0000,photo,https://www.facebook.com/iitgn.official/photos/a.340943985972946.80216.139092996158047/1072232379510766/?type=3,139092996158047_1072232379510766,NA,73,0,3
231,1.39E+14,IIT Gandhinagar,"The fifth edition of the summer internship research program (SRIP) is underway. The program is aimed at building strong ties with other institutions through research at IITGN. The program strives to bring together students and faculty from prominent institutions across the country right here on the IIT Gandhinagar campus at Palaj.

The SRIP interns have been beating the heat with their exciting projects, and participated in an orientation program today. Prof Sudhir K Jain addressed the students, motivating them towards pursuing a strong research agenda. He also had one-on-one interactions with them. 

Watch this space for updates on what the interns are up to this summer!",2016-05-28T13:35:00+0000,photo,https://www.facebook.com/iitgn.official/photos/a.340943985972946.80216.139092996158047/1071594036241267/?type=3,139092996158047_1071594466241224,IIT Gandhinagar added 6 new photos.,71,1,5
232,1.39E+14,IIT Gandhinagar,"We are pleased to announce ""Pahel --- Ek Shuruat"", a workshop organized by the Counseling Services at IIT Gandhinagar. This two-day workshop will be held on June 18th and 19th, 2016. 

The workshop aims to explore the role of counseling services at IITs and how institutions can reach out to students more effectively. The workshop will also involve discussions about ways in which we can effectively help the first generation students, and brainstorm some measures that enable a more positive culture on campus while keeping pace with the changing times.  

The schedule for the workshop is attached here. Please get in touch with Prof. Kabeer Jasuja with any queries that you might have. 

We look forward to an effective discourse with the help of your experiences, so do join us!",2016-05-28T08:30:00+0000,photo,https://www.facebook.com/iitgn.official/photos/a.340943985972946.80216.139092996158047/1071123296288341/?type=3,139092996158047_1071124026288268,IIT Gandhinagar added 2 new photos.,23,1,2
233,1.39E+14,IIT Gandhinagar,"IIT Gandhinagar features at the #8 position in the national ranking of the Top 150 Engineering Institutes, and at #2 in the West Region, according to the Times Engineering Institute Ranking Survey. 

The study had three major modules: Desk Research, Factual Survey & Perceptual Rating Survey. Find out more from: http://buff.ly/1sSOXfg and http://buff.ly/1sSPX31",2016-05-27T13:30:10+0000,photo,https://www.facebook.com/iitgn.official/photos/a.340943985972946.80216.139092996158047/1071003822966955/?type=3,139092996158047_1071003822966955,NA,73,0,8
234,1.39E+14,IIT Gandhinagar,"#ThrowbackThursday

Around this time last year, the #IITGNExplorers were out backpacking countrywide. Here are some picks from past, and you can find even more from their Facebook page here:

http://buff.ly/1TXLrWG 

Watch this space for updates from the teams keeping it cool this summer by backpacking to far-off lands this year!",2016-05-26T13:30:27+0000,photo,https://www.facebook.com/iitgn.official/photos/a.340943985972946.80216.139092996158047/1070430023024335/?type=3,139092996158047_1070430023024335,NA,30,0,1
235,1.39E+14,IIT Gandhinagar,"The vocational skills training program by NEEV, as featured by ABP Asmita:",2016-05-26T12:00:15+0000,link,http://buff.ly/1TY8Ffd,139092996158047_1070398686360802,NA,44,0,1
236,1.39E+14,IIT Gandhinagar,"Announcing the Open House at IITGN on 5th of June: please note that there have been some changes to the schedule posted earlier on this page! 

----

After having appeared for JEE Advanced on 22nd of May, prospective JEE students from all over the country are invited by IIT Gandhinagar to the Open House that will be held on 5th of June 2016. 

Come see the IIT Gandhinagar Permanent Campus! Sessions by faculty members of various branches, Deans and IITGN Director are lined up to address the general doubts of students regarding admission and also specific queries about IIT Gandhinagar.

Register for the Open House at: http://buff.ly/22m2TtZ
Visit our prospective students webpage: http://buff.ly/22m2PdB

Limited accommodation available- register soon!",2016-05-26T11:31:06+0000,photo,https://www.facebook.com/iitgn.official/photos/a.340943985972946.80216.139092996158047/1070389436361727/?type=3,139092996158047_1070389436361727,NA,28,0,17
