,from_id,from_name,message,created_time,type,link,id,story,likes_count,comments_count,shares_count
1,1.39E+14,IIT Gandhinagar,"Campus Feature: Zero Discharge Campus

There are no outgoing lines of sewage from the Campus to the Municipality, making the campus a zero-discharge campus. All waste water and sewage generated on campus are processed on campus and a large portion of it is used on campus as recycled water.",2017-03-27T13:30:25+0000,photo,https://www.facebook.com/iitgn.official/photos/a.340943985972946.80216.139092996158047/1368014976599170/?type=3,139092996158047_1368014976599170,NA,56,1,3
2,1.39E+14,IIT Gandhinagar,"IIT Gandhinagar Central Library suggests Book of the Week: ""Life of Pi"" by Yann Martel. http://ow.ly/3u9K30aaWBG 
#IITGNCentralLibrary #IITGNBookoftheWeek",2017-03-25T13:30:28+0000,link,http://ow.ly/3u9K30aaWBG,139092996158047_1365471710186830,NA,24,1,0
3,1.39E+14,IIT Gandhinagar,"Snapshots from the talk by Commodore Odakkal Johnson on 'India's Naval contribution during WW I& II'  held at IIT Gandhinagar, March 22, 2017.",2017-03-23T15:30:00+0000,photo,https://www.facebook.com/iitgn.official/photos/a.340943985972946.80216.139092996158047/1363071663760168/?type=3,139092996158047_1363072483760086,IIT Gandhinagar added 4 new photos.,102,0,1
4,1.39E+14,IIT Gandhinagar,"IIT Gandhinagar hosted a delegation of 15 senior members comprising Provosts, and International officers from institutions across the United States, and senior USIEF Fulbright representatives this morning at the campus. The visit was scheduled as a part of the 2017-2018 Fulbright-Nehru International Education Administrators Seminar. There were a series of presentations and discussions on various aspects of academics, infrastructure and research on IITGN campus. The delegation met and interacted with a group of students and faculty members to understand life at IIT Gandhinagar. EducationUSA Delhi The Fulbright Program EducationUSA Mumbai #FulbrightFellowship",2017-03-23T13:30:00+0000,photo,https://www.facebook.com/iitgn.official/photos/a.340943985972946.80216.139092996158047/1363123170421684/?type=3,139092996158047_1363130937087574,IIT Gandhinagar added 4 new photos.,98,0,2
5,1.39E+14,IIT Gandhinagar,"Wednesday Video: http://ow.ly/sycC30a8VYR 

Watch Dr. Raghunath Anant Mashelkar, Padma Vibhushan, Former Director General CSIR, the Founder Chairman of Board of Governor of IIT Gandhinagar, delivering the prestigious Nani Palkhivala Lecture  on the topic ""From Incremental to Disruptive Innovation: The Vision and Strategy"" on 17th September 2016.",2017-03-22T13:30:17+0000,video,http://ow.ly/sycC30a8VYR,139092996158047_1361994257201242,NA,39,2,1
6,1.39E+14,IIT Gandhinagar,"IIT Gandhinagar hosted an event on March 21, 2017 entitled 'The Songs of Protest' by Lokshair Sambhaji Bhagat, whose artistic expression has characterized issues of social justice pertaining to class and caste in contemporary India. Sambhaji Bhagat performed his famous songs with his troupe and gave a glimpse of the connection between art and truth through his storytelling.
Presenting some snapshots from the event. 

Pictures Courtesy: Gaurav Shukla",2017-03-22T11:30:00+0000,photo,https://www.facebook.com/iitgn.official/photos/a.340943985972946.80216.139092996158047/1361837937216874/?type=3,139092996158047_1361841893883145,IIT Gandhinagar added 4 new photos.,75,0,2
7,1.39E+14,IIT Gandhinagar,"IIT Gandhinagar family congratulates Professor Dinesh Garg for receiving a grant from the Science and Engineering Research Board (SERB)  for the project entitled, ""Non-convex Optimization Techniques for Large Scale Machine Learning Problems"".",2017-03-21T15:45:09+0000,status,NA,139092996158047_1361020043965330,NA,26,0,2
8,1.39E+14,IIT Gandhinagar,IIT Gandhinagar family congratulates Professor Naran Pindoria for being awarded IEEE Power & Energy Society (PES) Gujarat chapter Outstanding Engineer award (with experience less than 15 years) in recognition for his contributions to research in power systems and smart distribution grid.,2017-03-21T15:30:09+0000,status,NA,139092996158047_1361010740632927,NA,96,0,1
9,1.39E+14,IIT Gandhinagar,"Commodore Odakkal Johnson, a Maritime Professional for over 34 years and the Curator at Maritime History Society, Mumbai, will be visiting IIT Gandhinagar on March 22, 2017 to deliver a talk on 'India's Naval Contribution during WW I & II'
Venue: AB 1/001
Time: 4:00 PM
IIT Gandhinagar Contact: Col Sarvjeet Kapoor
#iitgntalks #iitgn",2017-03-21T13:30:25+0000,photo,https://www.facebook.com/iitgn.official/photos/a.340943985972946.80216.139092996158047/1360920847308583/?type=3,139092996158047_1360920847308583,NA,28,0,6
10,1.39E+14,IIT Gandhinagar,"Campus Feature: Fibre Optic Backbone

The entire campus IT services and ELV services are built upon a fibre-optic cable system referred to as the fibre-optic backbone. The fibre-optic backbone not only ensures blazing fast internet access, but also serves as a single network onto which all other services such as IP Telephony, CCTV and Security System, Fire Alarm System, Access Control System, a state-of- art Building Management System can plug into. The fibre-optic backbone thus forms the foundation of a Smart Campus and future IT services can plug into the same framework.",2017-03-20T13:30:28+0000,photo,https://www.facebook.com/iitgn.official/photos/a.340943985972946.80216.139092996158047/1359845370749464/?type=3,139092996158047_1359845370749464,NA,54,0,3
11,1.39E+14,IIT Gandhinagar,"Professor Andrew Whittaker from University at Buffalo (UB) is visiting IIT Gandhinagar on Wednesday, March 22, 2017. He will be delivering talks according to the schedule below.
Title: Seismic behavior of SC wall piers under in-plane and out-of-plane loadings
Time: 2:00 - 3:00 PM
Venue: AB 7/201

He will also hold a session on graduate studies at UB following the technical presentation per the schedule mentioned.
Title: Graduate studies in engineering at UB
Date: March 22 (Wednesday)
Time: 3:00 PM
Venue: AB 7/201",2017-03-17T08:30:11+0000,status,NA,139092996158047_1355811151152886,NA,32,0,1
12,1.39E+14,IIT Gandhinagar,"Wednesday Video: http://ow.ly/jBGS309V8vK 

The e-learning portal of the Swachh Bharat Mission features in-depth documentaries focusing on various leading practices in sanitation. The series on Municipal Solid Waste Management has a chapter on Biomethanation and Composting technologies which are being used at various bulk generators for the management of wet waste. The documentary features efforts at IIT Gandhinagar, along with the Art of Living International Center and the Vijay Nagar Society. 
On the IIT Gandhinagar campus, waste segregation is practiced in both the residential and the academic areas. Apart from biomedical or lab waste, everything else is typically classified as organic, recyclable or meant for the landfills. Color-coded dustbins and posters with detailed examples help users identify the right disposal option. As you can see in the video, our in-house biogas plant generates energy and manure from the organic waste. Combined with recycling and other measures, our campus presently diverts about 85% of the waste from the landfills. 

To see all the documentaries compiled about leading practices in the sanitation sector by the Swachh Bharat Mission, visit the e-learning portal here: http://ow.ly/CpfS309V8sy 

Developing a green and sustainable campus was a core guiding principle when IIT Gandhinagar set out to develop its campus. Our campus is the first to be awarded a 5-star GRIHA LD rating (the highest possible). Find out more about the green initiatives employed on our campus at: http://ow.ly/JkP8309V8tt",2017-03-15T13:30:30+0000,video,http://ow.ly/jBGS309V8vK,139092996158047_1353639471370054,NA,24,0,3
13,1.39E+14,IIT Gandhinagar,"We are pleased to announce that IIT Gandhinagar is hosting the ACM India Summer School on Graph Theory and Graph Algorithms. This is a three-week long program on our campus from 26th June, 2017 to 26th July, 2017. Please register for the school before the 31st of March. The list of shortlisted candidates will be published on our website by the end of April.

Find out more at: http://ow.ly/gsAD309V7hD 
Queries can be directed to: cse+acmschool@iitgn.ac.in",2017-03-15T08:30:15+0000,photo,https://www.facebook.com/iitgn.official/photos/a.340943985972946.80216.139092996158047/1353315218069146/?type=3,139092996158047_1353315218069146,NA,41,5,20
14,1.39E+14,IIT Gandhinagar,"IIT Gandhinagar Central Library suggests 'Book of the Week' every week. This week's suggestion: ""Einstein's greatest mistake: a biography"" by  David Bodanis. Publication Date: 29th September 2016. #IITGNCentralLibrary #IITGNBookoftheWeek
http://ow.ly/wEMC309M6gT",2017-03-11T08:30:20+0000,link,http://ow.ly/wEMC309M6gT,139092996158047_1348573725209962,NA,19,1,1
15,1.39E+14,IIT Gandhinagar,"Talk Title: The Changing Position of the Researcher and Research Participants: Implications for the Ethics of Fieldwork
Speaker: Dr Jyothsna Latha Belliappa
Date: March 15, 2017
Time: 4PM - 5:30PM
Venue: AB 7/202
 IIT Gandhinagar Contact: Professor Madhumita Sengupta
#iitgntalks",2017-03-10T08:30:15+0000,photo,https://www.facebook.com/iitgn.official/photos/a.340943985972946.80216.139092996158047/1347275695339765/?type=3,139092996158047_1347275695339765,NA,13,0,0
16,1.39E+14,IIT Gandhinagar,"Throwback Thursday
Holi celebrations during the early years of IIT Gandhinagar in the temporary campus at Chandkheda. The students in the picture are from 2008-09 batch. Picture Courtesy: Gaurav Shukla 
 Alumni Relations, IIT Gandhinagar IIT Gandhinagar Student Life 
 #ThrowbackThursday #TBT",2017-03-09T13:30:20+0000,photo,https://www.facebook.com/iitgn.official/photos/a.340943985972946.80216.139092996158047/1346097502124251/?type=3,139092996158047_1346097502124251,IIT Gandhinagar with Piyush Vankar and 5 others.,118,1,2
17,1.39E+14,IIT Gandhinagar,"Wednesday Video: http://ow.ly/HZ8Q309H959 
Watch out this video of the Public Talk by Nobel Laureate in Physiology or Medicine,1989, Professor Harold E. Varmus on ""How cells become cancers (and what we do about it)?"" held on Januray 11, 2017 at IIT Gandhinagar.",2017-03-08T13:30:25+0000,video,http://ow.ly/HZ8Q309H959,139092996158047_1344802005587134,NA,27,0,0
18,1.39E+14,IIT Gandhinagar,"Talk Title: Quantum Chaos and Stochastic Webs in a quantum-mechanical kick system
Speaker: Dr. Martin Engel, SAP SE, Germany
Date: March 8, 2017
Time: 3:30PM - 4:30PM
Venue: AB 7/102
 IIT Gandhinagar Contact: Professor Vinod Chandra
#iitgntalks",2017-03-08T05:00:08+0000,photo,https://www.facebook.com/iitgn.official/photos/a.340943985972946.80216.139092996158047/1344420078958660/?type=3,139092996158047_1344420078958660,NA,8,0,0
19,1.39E+14,IIT Gandhinagar,"The inspiring NEEV IITGN initiative captured eloquently on video! 

Anyone who wants to be involved in any way, large or small - please do get in touch with neev@iitgn.ac.in.",2017-03-04T05:07:30+0000,video,https://www.youtube.com/watch?v=x2qUcMfTyzA&t=1s,139092996158047_1340404232693578,IIT Gandhinagar shared NEEV IITGN's post.,21,0,0
20,1.39E+14,IIT Gandhinagar,"Talk Title: Spacecraft attitude control and the fiber bundle structure of the gimbal-spacecraft system
Speaker: Arjun Narayanan, Scientist, ISRO, VSSC, Thiruvananthapuram
Date: March 7, 2017
Time: 5PM - 6PM
Venue: AB 7/208
IIT Gandhinagar Contact: Professor Ravi Banavar
#iitgntalks",2017-03-03T11:30:10+0000,photo,https://www.facebook.com/iitgn.official/photos/a.340943985972946.80216.139092996158047/1339506732783328/?type=3,139092996158047_1339506732783328,NA,16,1,1
21,1.39E+14,IIT Gandhinagar,"IITGN participated in the Campus Bird Count on 18th Feb 2017. Staff, faculty and their families participated with enthusiasm. Mr. Sivakumar and Mr. Ramjee Nagarajan  Centre for Environment Education and Sundarvan Nature Discovery Centre) helped identify and count the birds.",2017-03-02T11:30:00+0000,photo,https://www.facebook.com/iitgn.official/photos/a.340943985972946.80216.139092996158047/1335632376504097/?type=3,139092996158047_1335632893170712,IIT Gandhinagar added 4 new photos — with Sivakumar Swaminathan.,88,0,2
22,1.39E+14,IIT Gandhinagar,"Snapshots from the inaugural ceremony of CLSTL 2017, the International Conference on Changing Landscape of Science & Technology Libraries. More details about the conference can be found on their website:

http://events.iitgn.ac.in/2017/CLSTL/

Watch this space for more updates in due course!",2017-03-02T09:35:39+0000,photo,https://www.facebook.com/iitgn.official/photos/a.340943985972946.80216.139092996158047/1338126546254680/?type=3,139092996158047_1338130709587597,IIT Gandhinagar added 12 new photos — with Amol Pachange and 15 others.,119,1,8
23,1.39E+14,IIT Gandhinagar,NA,2017-03-02T07:34:01+0000,link,https://www.facebook.com/Neeviitgn/posts/1908882556010033,139092996158047_1337983409602327,IIT Gandhinagar shared NEEV IITGN's post.,15,0,0
24,1.39E+14,IIT Gandhinagar,"Wednesday Video: http://ow.ly/3q6N309sQGC 

We continue our Wednesday Video series with videos from the Enigma of Nature seminar. Watch Prof. Jain's inaugural address for the event. The complete playlist is available at: http://ow.ly/SzAJ309sQLA",2017-03-01T11:30:16+0000,video,http://ow.ly/3q6N309sQGC,139092996158047_1337121453021856,NA,25,0,0
25,1.39E+14,IIT Gandhinagar,"IIT Gandhinagar Mathematics Discipline Seminar Series to host a talk by Professor Chandan S. Dalawat from HRI Allahabad.
Title - Solvable Primitive Extensions
Date & Time: March 3, 2017. 4:00 - 5:00 PM
Venue: AB 7/209
#iitgntalks",2017-03-01T08:30:27+0000,photo,https://www.facebook.com/iitgn.official/photos/a.340943985972946.80216.139092996158047/1336832139717454/?type=3,139092996158047_1336832139717454,NA,18,0,0
26,1.39E+14,IIT Gandhinagar,"Snapshots from the first edition of Research Opportunities in Computer Science (ROCS) 2017 held on the 24th of February, 2017.",2017-02-28T13:30:00+0000,photo,https://www.facebook.com/iitgn.official/photos/a.340943985972946.80216.139092996158047/1335642709836397/?type=3,139092996158047_1335643773169624,IIT Gandhinagar added 10 new photos — with Bireswar Das and 2 others.,142,0,1
27,1.39E+14,IIT Gandhinagar,"IIT Gandhinagar is organizing a conference on “Changing Landscape of Science & Technology Libraries” from March 2 - 4 March, 2017. The aim of the objective is to bring together library professionals and researchers from India and abroad to exchange their innovative ideas, new initiatives, experiences, research work, best practices etc and to understand how the Science & Technology (S & T) libraries are transforming themselves in the midst of rapid technology developments. The conference would also be addressing current issues, recent developments and their impact,and future challenges to prepare science and technology libraries for the future.
For further details visit: http://ow.ly/AOpK309qk8x",2017-02-28T08:30:11+0000,link,http://ow.ly/AOpK309qk8x,139092996158047_1335575066509828,NA,18,0,2
28,1.39E+14,IIT Gandhinagar,"Campus Feature: Mango Trees

It looks like we are poised for a good Mango season with the 19 fully grown Mango trees on campus showing a healthy bloom of flowers.
Any suggestions about how best to use these productively? These mangoes appear to be of a ‘khatta’ variety, and are perhaps better suited for processed mango items such as achar, panna, etc.",2017-02-27T08:30:09+0000,photo,https://www.facebook.com/iitgn.official/photos/a.340943985972946.80216.139092996158047/1334119353322066/?type=3,139092996158047_1334119353322066,NA,85,1,1
29,1.39E+14,IIT Gandhinagar,"The Summer Research Internship Programme at IIT Gandhinagar is now open. Details about the program, along with the list of projects, are available from the website:

http://sites.iitgn.ac.in/srip/

The deadline for applications is 5th March, 2017.",2017-02-24T10:45:00+0000,link,http://sites.iitgn.ac.in/srip/,139092996158047_1330999896967345,NA,99,4,25
30,1.39E+14,IIT Gandhinagar,"Wednesday Video: http://ow.ly/I2li309eLks 

We are pleased to share the video of the ceremonial naming of the 600-seat auditorium of IIT Gandhinagar as 'Jasubhai Memorial Auditorium', which took place on the evening of 10th February 2017. 

On this occasion, Mr. Maulik Jasubhai Shah, Mr. B. Narayan (Reliance Industries Limited), and Prof. Sudhir K Jain addressed the audience. The Minister of Railways, Shri Suresh Prabhu, also sent a video message.

The recording also features the magnificent musical performance by the Indian National Youth Orchestra!",2017-02-22T11:30:18+0000,video,http://ow.ly/I2li309eLks,139092996158047_1328781760522492,NA,21,0,1
31,1.39E+14,IIT Gandhinagar,"Campus Feature:

Many of you might have glanced at the face of Lal Minar and wondered what the pattern is all about. After much debate about whether it should be IIT Gandhinagar logo or a national symbol, the design team came up with a suggestion for an abstract design loosely inspired from what many believe to be an ancient sundial in India that can read the time to an accuracy of a minute. Did you know that the intricate design thus created and embossed in concrete is quite possibly the largest concrete embossing in India and that too at that height?",2017-02-20T08:30:12+0000,photo,https://www.facebook.com/iitgn.official/photos/a.340943985972946.80216.139092996158047/1324667297600605/?type=3,139092996158047_1324667297600605,NA,108,1,6
32,1.39E+14,IIT Gandhinagar,"The Discipline of Computer Science and Engineering at IIT Gandhinagar is organizing a one-day workshop on Research Opportunities in Computer Science on 24th February 2017 at the IIT Gandhinagar Campus.
The program features talks from the faculty of the CSE discipline highlighting major research trends in various areas of computer science and engineering, including algorithms, complexity theory, machine learning, game theory, mechanism design, data science and computer architecture and systems. 
The event is free to attend and will have various opportunities for informal interactions with faculty and students of CSE and related disciplines at IIT Gandhinagar. 

Register before the 20th of February to join us: 
http://ow.ly/Kaat3093Lry 
http://ow.ly/Rmqt3093Lul",2017-02-16T12:30:11+0000,photo,https://www.facebook.com/iitgn.official/photos/a.340943985972946.80216.139092996158047/1320241661376502/?type=3,139092996158047_1320241661376502,NA,35,0,8
33,1.39E+14,IIT Gandhinagar,"Wednesday Videos are back! The videos of lectures, seminars, public talks and other events happening over the last few months at IIT Gandhinagar will be shared here every week.

Presenting the video of the Public Talk by Nobel Laureate in Physiology or Medicine, Professor Randy Schekman on ""How cells exports proteins"" held on Januray 11, 2017 at IIT Gandhinagar. For the complete lecture follow: http://ow.ly/mDs53091bRQ",2017-02-15T13:45:06+0000,video,http://ow.ly/mDs53091bRQ,139092996158047_1318779574856044,NA,36,0,1
34,1.39E+14,IIT Gandhinagar,"IIT Gandhinagar family congratulates Team ISRO - Indian Space Research Organisation for the launch of PSLV C37, 104 Satellite in one go! You make the nation proud!",2017-02-15T08:55:23+0000,photo,https://www.facebook.com/tech.iitgn/photos/a.476491459113750.1073741826.476481355781427/1226138497482372/?type=3,139092996158047_1318303811570287,IIT Gandhinagar shared Technical Council IITGn's post.,75,0,0
35,1.39E+14,IIT Gandhinagar,"Campus Feature: HUDCO Design Awards 2016

The Academic Complex of IIT Gandhinagar  campus bagged the First Prize at the HUDCO Design Awards 2016 in the category of “Green Buildings”. The contributions of Mitimitra Consultants Pvt Ltd, dbHMS Consultants, CPWD and numerous people within and outside the IITGN campus in developing this unique and green academic complex, is gratefully acknowledged. For more details you can click here: http://ow.ly/cbhi308WPUD",2017-02-13T13:30:19+0000,photo,https://www.facebook.com/iitgn.official/photos/a.340943985972946.80216.139092996158047/1316030141797654/?type=3,139092996158047_1316030141797654,NA,86,0,3
36,1.39E+14,IIT Gandhinagar,"IIT Gandhinagar hosted the ninth Faculty and Staff picnic at Aranya Uddhyan, Gandhinagar on Sunday. It was a day full of games, musical performances, mouth watering lunch, a bird-identifying walk in the jungle, visit to Sabarmati river bank and an interesting crossword competition based on IITGN Family. 

Mithun Radhakrishna gave a Mandolin performance, and there were vocals by Atul Dixit, Daksh, Umashankar and others.

The IITGN crossword competition first prize went to Babloo Sharma, Suganya Arumugam, Renu Mittal, Arnapurna Rath and Amit Arora. First runners up : Deepak Agnihotri, Rajendra Vaishnav, Nand Lal Vishwakarma, Narendra Solanki, Gaurav Kumar Singh. 
Second runners up : Surya Pratap Mehrotra, Sarvjeet Kapoor, Chandrakumar Appayee, Biresh Chaubey, Umashankar Singh.

Pictures Courtesy: Dev Barbhaya",2017-02-13T03:30:00+0000,photo,https://www.facebook.com/iitgn.official/photos/a.340943985972946.80216.139092996158047/1315310705202931/?type=3,139092996158047_1315335671867101,IIT Gandhinagar added 13 new photos — with Atul Singh and 11 others.,149,0,3
37,1.39E+14,IIT Gandhinagar,"The ceremonial naming of the 600-seat auditorium of IIT Gandhinagar as 'Jasubhai Memorial Auditorium' took place on the  evening of 10th February 2017. The event coincided with the birth anniversary of Late Jasubhai Shah. Mr. B. Narayan, Group President, Procurement& Projects, Reliance Industries Limited, was the Chief Guest on this occasion. Mr. Maulik Jasubhai Shah delivered the address on behalf of Jasubhai group. The Minister of Railways, Shri Suresh Prabhu sent a video message recounting the memory of Late Jasubhai, emphasizing the significance of naming the IIT Gandhinagar auditorium as 'Jasubhai Memorial Auditorium'. Professor Sudhir K Jain addressed the audience highlighting the significance of philanthropic contributions to academic institutions. 

Members of the Indian National Youth Orchestra performed during the evening. 

Pictures Courtesy: Jyotirban Dey & Dev Barbhaya",2017-02-11T04:03:45+0000,photo,https://www.facebook.com/iitgn.official/photos/a.340943985972946.80216.139092996158047/1313490995384902/?type=3,139092996158047_1313499705384031,IIT Gandhinagar added 13 new photos — with Sudhir K Jain.,170,0,4
38,1.39E+14,IIT Gandhinagar,"Cisco Supports Research on Online Analytics for Complex Systems at IIT Gandhinagar 

Cisco is empowering research on online analytics for complex systems at IIT Gandhinagar through a generous research grant. Professor Anirban Dasgupta from the Computer Science and Engineering discipline at IIT Gandhinagar is the principal investigator of this grant. The support from CISCO amounts to 75,000 USD and the project will be executed over a period of two years. 

According to Professor Dasgupta, ""With the proliferation of sensors, it is now fairly common to use data collected from such sensors in order to track the health of complex engineered systems that are pervasive in various domains. Examples of such systems are large datacenters that utilize thousands of machines, automated manufacturing, nuclear plants, as well as complex ad-serving software e.g. the ones used at Google and Microsoft. However, in order to truly understand the health of the system, and to figure out whether the current behavior of the system is bordering on anomaly, it is essential to take a global view of the data rather than look at individual sensors. Understanding the interaction of the different sensors using statistical models can lead to improvements in diverse problems of immense practical significance, e.g. preventing cascading failures by triggering appropriate safeguards. Such decisions also need to be taken in real-time.""

 The ongoing research supported by CISCO aims to develop techniques for such decision-making, which involves borrowing techniques from streaming algorithms, as well as statistical machine learning models. #iitgnfacultyachievements #iitgnfaculty #NeverBetter",2017-02-09T15:29:33+0000,link,http://donate.iitgn.ac.in/,139092996158047_1312470962153572,NA,57,0,0
39,1.39E+14,IIT Gandhinagar,"The ceremonial naming of the 600-seat auditorium at the Academic Block 1 of IIT Gandhinagar will be held tomorrow at the campus. It is a landmark event meant to celebrate the establishment of the 'Jasubhai Memorial Endowment' at the Institute, to be setup in memory of Mr Jasubhai Shah, Founder President of Chemtech Foundation and the Jasubhai Group. The Endowment is to support educational and research excellence and the ‘Jasubhai Memorial Chair’ at the Institute. The naming of the auditorium as 'Jasubhai Memorial Auditorium' is to honour and acknowledge the contributions of Jasubhai Shah and the Jasubhai group.

This is the first major philanthropic naming of the institute's infrastructural facilities. The vision of Professor Sudhir K Jain, Director IIT Gandhinagar, and efforts of the team members culminates in this significant moment. 

The event is open to public. Program starts at 4.45PM.",2017-02-09T08:30:00+0000,photo,https://www.facebook.com/iitgn.official/photos/a.340943985972946.80216.139092996158047/1312175785516423/?type=3,139092996158047_1312187105515291,IIT Gandhinagar added 2 new photos.,36,0,2
40,1.39E+14,IIT Gandhinagar,"Blithchron 2017 returns with promise of more fun, more music, and more events! Join-in the mega cultural festival of IIT Gandhinagar Student Life.",2017-02-08T17:41:11+0000,photo,https://www.facebook.com/IITGNStudentLife/photos/a.221329674550570.77802.220830191267185/1623819367634920/?type=3,139092996158047_1311666202234048,IIT Gandhinagar shared IIT Gandhinagar Student Life's post.,54,0,0
